{
  "attempts" : [
    {
      "derivedMetrics" : {
        "decodeTokensPerSecond" : null,
        "firstRenderableProxyTTFTMilliseconds" : null,
        "pipelineTTFTMilliseconds" : null,
        "prefillTokensPerSecond" : null,
        "processPhysicalFootprintMiB" : null,
        "requestCompletionMilliseconds" : null
      },
      "generatedText" : "Don't worry, your note is safely stored on this iPhone and will automatically sync once you regain internet connection. You can access it anytime.",
      "memorySamples" : [
        {
          "elapsedNanoseconds" : 19083,
          "physicalFootprintBytes" : 2660747912
        },
        {
          "elapsedNanoseconds" : 53456542,
          "physicalFootprintBytes" : 2664827528
        },
        {
          "elapsedNanoseconds" : 106891500,
          "physicalFootprintBytes" : 2664827528
        },
        {
          "elapsedNanoseconds" : 160287958,
          "physicalFootprintBytes" : 2664827528
        },
        {
          "elapsedNanoseconds" : 213737458,
          "physicalFootprintBytes" : 2664827528
        },
        {
          "elapsedNanoseconds" : 267212958,
          "physicalFootprintBytes" : 2664843912
        },
        {
          "elapsedNanoseconds" : 319182667,
          "physicalFootprintBytes" : 2665253512
        },
        {
          "elapsedNanoseconds" : 372571250,
          "physicalFootprintBytes" : 2665253512
        },
        {
          "elapsedNanoseconds" : 425991458,
          "physicalFootprintBytes" : 2665368200
        },
        {
          "elapsedNanoseconds" : 479384958,
          "physicalFootprintBytes" : 2665368200
        },
        {
          "elapsedNanoseconds" : 532772458,
          "physicalFootprintBytes" : 2670594696
        },
        {
          "elapsedNanoseconds" : 586428083,
          "physicalFootprintBytes" : 2719632008
        },
        {
          "elapsedNanoseconds" : 639847292,
          "physicalFootprintBytes" : 2720647816
        },
        {
          "elapsedNanoseconds" : 693262583,
          "physicalFootprintBytes" : 2721958536
        },
        {
          "elapsedNanoseconds" : 746697542,
          "physicalFootprintBytes" : 2722859656
        },
        {
          "elapsedNanoseconds" : 800269292,
          "physicalFootprintBytes" : 2723203720
        },
        {
          "elapsedNanoseconds" : 852117333,
          "physicalFootprintBytes" : 2724186760
        },
        {
          "elapsedNanoseconds" : 905560833,
          "physicalFootprintBytes" : 2724514440
        },
        {
          "elapsedNanoseconds" : 959003250,
          "physicalFootprintBytes" : 2725759624
        },
        {
          "elapsedNanoseconds" : 1012502875,
          "physicalFootprintBytes" : 2726087304
        },
        {
          "elapsedNanoseconds" : 1066000583,
          "physicalFootprintBytes" : 2727529096
        },
        {
          "elapsedNanoseconds" : 1119463292,
          "physicalFootprintBytes" : 2728512136
        },
        {
          "elapsedNanoseconds" : 1172907792,
          "physicalFootprintBytes" : 2729167496
        },
        {
          "elapsedNanoseconds" : 1226372583,
          "physicalFootprintBytes" : 2730150536
        },
        {
          "elapsedNanoseconds" : 1279819583,
          "physicalFootprintBytes" : 2730150536
        },
        {
          "elapsedNanoseconds" : 1333281375,
          "physicalFootprintBytes" : 2730805896
        },
        {
          "elapsedNanoseconds" : 1384647875,
          "physicalFootprintBytes" : 2747828872
        },
        {
          "elapsedNanoseconds" : 1435580750,
          "physicalFootprintBytes" : 2747976328
        },
        {
          "elapsedNanoseconds" : 1489009750,
          "physicalFootprintBytes" : 2747992712
        },
        {
          "elapsedNanoseconds" : 1542452375,
          "physicalFootprintBytes" : 2747533960
        },
        {
          "elapsedNanoseconds" : 1593625125,
          "physicalFootprintBytes" : 2747681416
        },
        {
          "elapsedNanoseconds" : 1647075500,
          "physicalFootprintBytes" : 2747681416
        },
        {
          "elapsedNanoseconds" : 1700565542,
          "physicalFootprintBytes" : 2747812488
        },
        {
          "elapsedNanoseconds" : 1754017833,
          "physicalFootprintBytes" : 2747812488
        },
        {
          "elapsedNanoseconds" : 1807408458,
          "physicalFootprintBytes" : 2747976328
        },
        {
          "elapsedNanoseconds" : 1860329375,
          "physicalFootprintBytes" : 2748009096
        },
        {
          "elapsedNanoseconds" : 1913809333,
          "physicalFootprintBytes" : 2748009096
        },
        {
          "elapsedNanoseconds" : 1967234292,
          "physicalFootprintBytes" : 2748009096
        },
        {
          "elapsedNanoseconds" : 2020826750,
          "physicalFootprintBytes" : 2748009096
        },
        {
          "elapsedNanoseconds" : 2074254458,
          "physicalFootprintBytes" : 2747894408
        },
        {
          "elapsedNanoseconds" : 2127634333,
          "physicalFootprintBytes" : 2747894408
        },
        {
          "elapsedNanoseconds" : 2181048792,
          "physicalFootprintBytes" : 2747894408
        },
        {
          "elapsedNanoseconds" : 2234606750,
          "physicalFootprintBytes" : 2747894408
        },
        {
          "elapsedNanoseconds" : 2288101375,
          "physicalFootprintBytes" : 2747894408
        },
        {
          "elapsedNanoseconds" : 2341474000,
          "physicalFootprintBytes" : 2747894408
        },
        {
          "elapsedNanoseconds" : 2394915083,
          "physicalFootprintBytes" : 2747894408
        },
        {
          "elapsedNanoseconds" : 2448336375,
          "physicalFootprintBytes" : 2747894408
        },
        {
          "elapsedNanoseconds" : 2501708417,
          "physicalFootprintBytes" : 2747894408
        },
        {
          "elapsedNanoseconds" : 2544492375,
          "physicalFootprintBytes" : 2747746952
        }
      ],
      "outcome" : "completed",
      "outputTokenCount" : 28,
      "promptTokenCount" : 64,
      "reasonCodes" : [

      ],
      "renderabilityTrace" : {
        "captureLimit" : 32,
        "clockOrigin" : "adapter-request-accepted",
        "entries" : [
          {
            "decodedAtNanoseconds" : 1797996458,
            "decodedPrefix" : "Don",
            "isRenderable" : true,
            "tokenID" : 8161,
            "tokenIndex" : 0,
            "tokenReceivedNanoseconds" : 1797853000
          }
        ],
        "firstRenderableTokenIndex" : 0,
        "generationStartNanoseconds" : 4990000,
        "outcome" : "firstRenderableFound",
        "policyVersion" : "first-renderable-decoded-prefix-v1",
        "scope" : "through-first-renderable-inclusive"
      },
      "responseConformance" : {
        "reasonCodes" : [
          "response_conformance_failed"
        ],
        "status" : "fail"
      },
      "role" : "warmup",
      "runIndex" : 0,
      "stopReason" : "endOfSequence",
      "thermal" : {
        "after" : "nominal",
        "before" : "nominal",
        "transitions" : [

        ]
      },
      "timingEvidence" : {
        "generationStartNanoseconds" : 4990000,
        "promptEvaluationNanoseconds" : 1792451978,
        "requestCompletionNanoseconds" : 2544211875
      },
      "tokenEvents" : [
        {
          "elapsedNanoseconds" : 1792863000,
          "index" : 0,
          "tokenID" : 8161
        },
        {
          "elapsedNanoseconds" : 1822275625,
          "index" : 1,
          "tokenID" : 956
        },
        {
          "elapsedNanoseconds" : 1848433500,
          "index" : 2,
          "tokenID" : 11196
        },
        {
          "elapsedNanoseconds" : 1874484666,
          "index" : 3,
          "tokenID" : 11
        },
        {
          "elapsedNanoseconds" : 1900406708,
          "index" : 4,
          "tokenID" : 701
        },
        {
          "elapsedNanoseconds" : 1926435375,
          "index" : 5,
          "tokenID" : 5296
        },
        {
          "elapsedNanoseconds" : 1952610541,
          "index" : 6,
          "tokenID" : 374
        },
        {
          "elapsedNanoseconds" : 1978639708,
          "index" : 7,
          "tokenID" : 21676
        },
        {
          "elapsedNanoseconds" : 2004754625,
          "index" : 8,
          "tokenID" : 9967
        },
        {
          "elapsedNanoseconds" : 2030920041,
          "index" : 9,
          "tokenID" : 389
        },
        {
          "elapsedNanoseconds" : 2057065666,
          "index" : 10,
          "tokenID" : 420
        },
        {
          "elapsedNanoseconds" : 2083215958,
          "index" : 11,
          "tokenID" : 12443
        },
        {
          "elapsedNanoseconds" : 2109431750,
          "index" : 12,
          "tokenID" : 323
        },
        {
          "elapsedNanoseconds" : 2135635041,
          "index" : 13,
          "tokenID" : 690
        },
        {
          "elapsedNanoseconds" : 2161659083,
          "index" : 14,
          "tokenID" : 9651
        },
        {
          "elapsedNanoseconds" : 2187782666,
          "index" : 15,
          "tokenID" : 13105
        },
        {
          "elapsedNanoseconds" : 2213904208,
          "index" : 16,
          "tokenID" : 3131
        },
        {
          "elapsedNanoseconds" : 2239997833,
          "index" : 17,
          "tokenID" : 499
        },
        {
          "elapsedNanoseconds" : 2265997958,
          "index" : 18,
          "tokenID" : 49655
        },
        {
          "elapsedNanoseconds" : 2291956208,
          "index" : 19,
          "tokenID" : 7757
        },
        {
          "elapsedNanoseconds" : 2318096791,
          "index" : 20,
          "tokenID" : 3717
        },
        {
          "elapsedNanoseconds" : 2344429166,
          "index" : 21,